<xs:schema xmlns:xs="http://www.w3.org/2001/XMLSchema"
    targetNamespace="http://localhost/rssfeed"
    xmlns="http://localhost/rssfeed"
    elementFormDefault="qualified">

  <xs:element name="categories">
    <xs:complexType>
      <xs:sequence>
        <xs:element name="category" maxOccurs="unbounded">
          <xs:complexType>
            <xs:sequence>
              <xs:element name="category_id" type="xs:integer" />
              <xs:element name="name" type="xs:string" />
            </xs:sequence>
          </xs:complexType>
        </xs:element>
      </xs:sequence>
    </xs:complexType>
  </xs:element>

</xs:schema>
